<?xml version="1.0" encoding="UTF-8"?>
<?xml-stylesheet type="text/xsl" href="topbands2.xsl"?>
<bands xmlns:xsi="http://www.w3.org/2001/XMLSchema-instance" xsi:noNamespaceSchemaLocation="topbands.xsd">
   <band active="true">
      <title>Angra</title>
      <year>1985</year>
      <members>
         <member>
            <fullname>Fabio Lione</fullname>
            <instruments>
               <instrument>Voice</instrument>
            </instruments>
         </member>
      </members>
   </band>
   <band>
      <title>Rage</title>
      <year>2002</year>
   </band>
   <band>
      <title>Red Hot Chili Peppers</title>
      <year>1980</year>
   </band>
   <band>
      <title>The Beatles</title>
      <year>1958</year>
   </band>
   <band>
      <title>Christofer Cross</title>
      <year>1970</year>
   </band>
</bands>
